{
  "checkpoint": {
    "destination": {
      "camera_x": 1024,
      "section": 2,
      "x": 1056,
      "y": 160
    },
    "page": 4,
    "section": 2
  },
  "entry": {
    "camera_x": 0,
    "section": 2,
    "x": 40,
    "y": 160
  },
  "format_version": 1,
  "hud": {
    "health": 4,
    "lives": 2
  },
  "level": {
    "id": "stilt-gardens"
  },
  "music": "garden",
  "placements": [
    {
      "index": 0,
      "section": 2,
      "type": "gem",
      "x": 330,
      "y": 112
    },
    {
      "index": 1,
      "section": 2,
      "type": "gem",
      "x": 346,
      "y": 112
    },
    {
      "index": 2,
      "section": 2,
      "type": "walker",
      "x": 400,
      "y": 196
    },
    {
      "index": 3,
      "section": 2,
      "type": "gem",
      "x": 560,
      "y": 120
    },
    {
      "index": 4,
      "section": 2,
      "type": "walker",
      "x": 720,
      "y": 196
    },
    {
      "index": 5,
      "section": 2,
      "type": "gem",
      "x": 935,
      "y": 120
    },
    {
      "index": 6,
      "section": 2,
      "type": "walker",
      "x": 1100,
      "y": 196
    },
    {
      "index": 7,
      "section": 2,
      "type": "gem",
      "x": 1280,
      "y": 120
    },
    {
      "index": 8,
      "section": 2,
      "type": "walker",
      "x": 1400,
      "y": 196
    },
    {
      "index": 9,
      "section": 2,
      "type": "gem",
      "x": 1610,
      "y": 112
    },
    {
      "index": 10,
      "section": 2,
      "type": "gem",
      "x": 1626,
      "y": 112
    },
    {
      "index": 11,
      "section": 2,
      "type": "walker",
      "x": 1650,
      "y": 196
    },
    {
      "index": 12,
      "section": 2,
      "type": "walker",
      "x": 1880,
      "y": 196
    },
    {
      "index": 13,
      "section": 2,
      "type": "goal",
      "x": 2000,
      "y": 184
    }
  ],
  "retry": {
    "camera_x": 0,
    "section": 2,
    "x": 40,
    "y": 160
  },
  "sections": [
    {
      "tileset": "meadow"
    },
    {
      "tileset": "meadow"
    },
    {
      "tileset": "garden"
    },
    {
      "tileset": "meadow"
    },
    {
      "tileset": "meadow"
    },
    {
      "tileset": "meadow"
    },
    {
      "tileset": "meadow"
    }
  ],
  "terrain": {
    "columns": 8,
    "grid": [
      255,
      255,
      255,
      255,
      255,
      255,
      255,
      255,
      255,
      255,
      255,
      255,
      255,
      255,
      255,
      255,
      0,
      1,
      2,
      3,
      4,
      5,
      6,
      7,
      255,
      255,
      255,
      255,
      255,
      255,
      255,
      255,
      255,
      255,
      255,
      255,
      255,
      255,
      255,
      255,
      255,
      255,
      255,
      255,
      255,
      255,
      255,
      255,
      255,
      255,
      255,
      255,
      255,
      255,
      255,
      255
    ],
    "metatiles": [
      {
        "collision": 0,
        "tile": ""
      },
      {
        "collision": 1,
        "tile": "ground-top"
      },
      {
        "collision": 1,
        "tile": "ground"
      },
      {
        "collision": 1,
        "tile": "block"
      },
      {
        "collision": 2,
        "tile": "vine"
      },
      {
        "collision": 1,
        "tile": "ledge"
      },
      {
        "collision": 0,
        "tile": "grass"
      },
      {
        "collision": 0,
        "tile": ""
      },
      {
        "collision": 0,
        "tile": ""
      },
      {
        "collision": 0,
        "tile": ""
      },
      {
        "collision": 0,
        "tile": ""
      },
      {
        "collision": 0,
        "tile": ""
      },
      {
        "collision": 0,
        "tile": ""
      },
      {
        "collision": 0,
        "tile": ""
      },
      {
        "collision": 0,
        "tile": ""
      },
      {
        "collision": 0,
        "tile": ""
      },
      {
        "collision": 0,
        "tile": ""
      },
      {
        "collision": 0,
        "tile": ""
      },
      {
        "collision": 0,
        "tile": ""
      },
      {
        "collision": 0,
        "tile": ""
      },
      {
        "collision": 0,
        "tile": ""
      },
      {
        "collision": 0,
        "tile": ""
      },
      {
        "collision": 0,
        "tile": ""
      },
      {
        "collision": 0,
        "tile": ""
      },
      {
        "collision": 0,
        "tile": ""
      },
      {
        "collision": 0,
        "tile": ""
      },
      {
        "collision": 0,
        "tile": ""
      },
      {
        "collision": 0,
        "tile": ""
      },
      {
        "collision": 0,
        "tile": ""
      },
      {
        "collision": 0,
        "tile": ""
      },
      {
        "collision": 0,
        "tile": ""
      },
      {
        "collision": 0,
        "tile": ""
      },
      {
        "collision": 0,
        "tile": ""
      },
      {
        "collision": 0,
        "tile": ""
      },
      {
        "collision": 0,
        "tile": ""
      },
      {
        "collision": 0,
        "tile": ""
      },
      {
        "collision": 0,
        "tile": ""
      },
      {
        "collision": 0,
        "tile": ""
      },
      {
        "collision": 0,
        "tile": ""
      },
      {
        "collision": 0,
        "tile": ""
      },
      {
        "collision": 0,
        "tile": ""
      },
      {
        "collision": 0,
        "tile": ""
      },
      {
        "collision": 0,
        "tile": ""
      },
      {
        "collision": 0,
        "tile": ""
      },
      {
        "collision": 0,
        "tile": ""
      },
      {
        "collision": 0,
        "tile": ""
      },
      {
        "collision": 0,
        "tile": ""
      },
      {
        "collision": 0,
        "tile": ""
      },
      {
        "collision": 0,
        "tile": ""
      },
      {
        "collision": 0,
        "tile": ""
      },
      {
        "collision": 0,
        "tile": ""
      },
      {
        "collision": 0,
        "tile": ""
      },
      {
        "collision": 0,
        "tile": ""
      },
      {
        "collision": 0,
        "tile": ""
      },
      {
        "collision": 0,
        "tile": ""
      },
      {
        "collision": 0,
        "tile": ""
      },
      {
        "collision": 0,
        "tile": ""
      },
      {
        "collision": 0,
        "tile": ""
      },
      {
        "collision": 0,
        "tile": ""
      },
      {
        "collision": 0,
        "tile": ""
      },
      {
        "collision": 0,
        "tile": ""
      },
      {
        "collision": 0,
        "tile": ""
      },
      {
        "collision": 0,
        "tile": ""
      },
      {
        "collision": 0,
        "tile": ""
      },
      {
        "collision": 0,
        "tile": ""
      },
      {
        "collision": 0,
        "tile": ""
      },
      {
        "collision": 0,
        "tile": ""
      },
      {
        "collision": 0,
        "tile": ""
      },
      {
        "collision": 0,
        "tile": ""
      },
      {
        "collision": 0,
        "tile": ""
      },
      {
        "collision": 0,
        "tile": ""
      },
      {
        "collision": 0,
        "tile": ""
      },
      {
        "collision": 0,
        "tile": ""
      },
      {
        "collision": 0,
        "tile": ""
      },
      {
        "collision": 0,
        "tile": ""
      },
      {
        "collision": 0,
        "tile": ""
      },
      {
        "collision": 0,
        "tile": ""
      },
      {
        "collision": 0,
        "tile": ""
      },
      {
        "collision": 0,
        "tile": ""
      },
      {
        "collision": 0,
        "tile": ""
      },
      {
        "collision": 0,
        "tile": ""
      },
      {
        "collision": 0,
        "tile": ""
      },
      {
        "collision": 0,
        "tile": ""
      },
      {
        "collision": 0,
        "tile": ""
      },
      {
        "collision": 0,
        "tile": ""
      },
      {
        "collision": 0,
        "tile": ""
      },
      {
        "collision": 0,
        "tile": ""
      },
      {
        "collision": 0,
        "tile": ""
      },
      {
        "collision": 0,
        "tile": ""
      },
      {
        "collision": 0,
        "tile": ""
      },
      {
        "collision": 0,
        "tile": ""
      },
      {
        "collision": 0,
        "tile": ""
      },
      {
        "collision": 0,
        "tile": ""
      },
      {
        "collision": 0,
        "tile": ""
      },
      {
        "collision": 0,
        "tile": ""
      },
      {
        "collision": 0,
        "tile": ""
      },
      {
        "collision": 0,
        "tile": ""
      },
      {
        "collision": 0,
        "tile": ""
      },
      {
        "collision": 0,
        "tile": ""
      },
      {
        "collision": 0,
        "tile": ""
      },
      {
        "collision": 0,
        "tile": ""
      },
      {
        "collision": 0,
        "tile": ""
      },
      {
        "collision": 0,
        "tile": ""
      },
      {
        "collision": 0,
        "tile": ""
      },
      {
        "collision": 0,
        "tile": ""
      },
      {
        "collision": 0,
        "tile": ""
      },
      {
        "collision": 0,
        "tile": ""
      },
      {
        "collision": 0,
        "tile": ""
      },
      {
        "collision": 0,
        "tile": ""
      },
      {
        "collision": 0,
        "tile": ""
      },
      {
        "collision": 0,
        "tile": ""
      },
      {
        "collision": 0,
        "tile": ""
      },
      {
        "collision": 0,
        "tile": ""
      },
      {
        "collision": 0,
        "tile": ""
      },
      {
        "collision": 0,
        "tile": ""
      },
      {
        "collision": 0,
        "tile": ""
      },
      {
        "collision": 0,
        "tile": ""
      },
      {